{
  "id": "agent:codex",
  "kind": "agent",
  "name": "OpenAI Codex",
  "version": "system",

  "delivery": "system",
  "install": {
    "source": "system"
  },

  "bins": ["codex"],

  "detect": {
    "command": "codex --version",
    "expectExitCode": 0
  },

  "installHints": {
    "manual": "Install or update with OpenAI's standalone installer: curl -fsSL https://chatgpt.com/codex/install.sh | sh"
  },

  "auth": {
    "required": true,
    "command": "codex login",
    "instructions": "Run 'codex login' to authenticate with your ChatGPT account or configure an OpenAI API key"
  },

  "meta": {
    "description": "OpenAI Codex CLI - AI coding assistant",
    "category": "ai-assistant",
    "homepage": "https://developers.openai.com/codex/cli",
    "executionOwner": "openai",
    "headlessCommand": "codex exec --json <prompt>"
  }
}
