{
  "id": "binary:imagemagick",
  "kind": "binary",
  "name": "ImageMagick",
  "version": "7.1",

  "delivery": "remote",
  "install": {
    "source": "download",
    "platforms": {
      "darwin-arm64": {
        "url": "https://github.com/learnrudi/registry/releases/download/v1.0.0/imagemagick-7.1-darwin-arm64.tar.gz",
        "checksum": { "algo": "sha256", "value": "0000000000000000000000000000000000000000000000000000000000000000" },
        "extract": { "type": "tar.gz" }
      },
      "darwin-x64": {
        "url": "https://github.com/learnrudi/registry/releases/download/v1.0.0/imagemagick-7.1-darwin-x64.tar.gz",
        "checksum": { "algo": "sha256", "value": "0000000000000000000000000000000000000000000000000000000000000000" },
        "extract": { "type": "tar.gz" }
      }
    }
  },

  "bins": {
    "magick": { "path": "magick" },
    "convert": { "path": "convert" },
    "identify": { "path": "identify" }
  },

  "detect": {
    "command": "magick --version",
    "expectExitCode": 0
  },

  "meta": {
    "description": "Image processing and manipulation toolkit",
    "category": "media"
  }
}
