{
  "id": "stack:github",
  "kind": "stack",
  "name": "GitHub",
  "version": "1.0.0",

  "delivery": "remote",
  "install": {
    "source": "catalog",
    "path": "catalog/stacks/github"
  },

  "runtime": "node",
  "requires": {
    "binaries": [],
    "secrets": [
      {
        "key": "GITHUB_TOKEN",
        "label": "GitHub Personal Access Token",
        "required": true,
        "helpUrl": "https://github.com/settings/tokens"
      }
    ]
  },
  "provides": {
    "tools": [
      "github_rest_request",
      "github_list_repos",
      "github_get_repo",
      "github_create_repo",
      "github_update_repo",
      "github_delete_repo",
      "github_list_branches",
      "github_get_branch",
      "github_create_branch",
      "github_delete_branch",
      "github_search_code",
      "github_get_file",
      "github_put_file",
      "github_delete_file",
      "github_list_collaborators",
      "github_add_collaborator",
      "github_remove_collaborator",
      "github_list_prs",
      "github_get_pr",
      "github_create_pr",
      "github_update_pr",
      "github_merge_pr",
      "github_list_pr_files",
      "github_list_pr_commits",
      "github_list_pr_reviews",
      "github_create_pr_review",
      "github_request_pr_reviewers",
      "github_remove_pr_reviewers",
      "github_list_issues",
      "github_get_issue",
      "github_create_issue",
      "github_update_issue",
      "github_add_comment",
      "github_list_comments",
      "github_update_comment",
      "github_delete_comment",
      "github_list_labels",
      "github_create_label",
      "github_update_label",
      "github_delete_label",
      "github_add_issue_labels",
      "github_set_issue_labels",
      "github_remove_issue_label",
      "github_list_milestones",
      "github_create_milestone",
      "github_update_milestone",
      "github_delete_milestone",
      "github_list_releases",
      "github_get_release",
      "github_create_release",
      "github_update_release",
      "github_delete_release",
      "github_list_workflows",
      "github_dispatch_workflow",
      "github_list_workflow_runs",
      "github_get_workflow_run",
      "github_rerun_workflow_run",
      "github_cancel_workflow_run",
      "github_list_artifacts",
      "github_delete_artifact"
    ]
  },
  "mcp": {
    "transport": "stdio",
    "command": "node",
    "args": ["dist/index.js"],
    "cwd": "."
  },

  "meta": {
    "description": "Manage GitHub repositories, branches, contents, collaborators, issues, pull requests, releases, Actions, artifacts, and direct REST API calls",
    "author": "RUDI",
    "license": "MIT",
    "category": "development",
    "tags": ["github", "git", "repos", "prs", "issues", "releases", "actions"],
    "icon": "🐙"
  }
}
