{
  "id": "binary:rclone",
  "kind": "binary",
  "name": "rclone",
  "version": "1.68.2",
  "delivery": "remote",
  "install": {
    "source": "download",
    "platforms": {
      "darwin-arm64": {
        "url": "https://downloads.rclone.org/v1.68.2/rclone-v1.68.2-osx-arm64.zip",
        "checksum": {
          "algo": "sha256",
          "value": "323f387b32bcf9ddfc3874f01879a0b2689dbd91309beb8c3a4410db04d0c41f"
        },
        "extract": {
          "type": "zip",
          "strip": 1
        }
      },
      "darwin-x64": {
        "url": "https://downloads.rclone.org/v1.68.2/rclone-v1.68.2-osx-amd64.zip",
        "checksum": {
          "algo": "sha256",
          "value": "cdc685e16abbf35b6f47c95b2a5b4ad73a73921ff6842e5f4136c8b461756188"
        },
        "extract": {
          "type": "zip",
          "strip": 1
        }
      },
      "linux-x64": {
        "url": "https://downloads.rclone.org/v1.68.2/rclone-v1.68.2-linux-amd64.zip",
        "checksum": {
          "algo": "sha256",
          "value": "0e6fa18051e67fc600d803a2dcb10ddedb092247fc6eee61be97f64ec080a13c"
        },
        "extract": {
          "type": "zip",
          "strip": 1
        }
      }
    }
  },
  "bins": [
    "rclone"
  ],
  "detect": {
    "command": "rclone --version",
    "expectExitCode": 0
  },
  "meta": {
    "description": "Cloud storage CLI (Google Drive, S3, Dropbox, 40+ providers)",
    "category": "utilities"
  }
}
