{
  "id": "agent:gemini",
  "kind": "agent",
  "name": "Gemini CLI",
  "version": "system",

  "delivery": "system",
  "install": {
    "source": "system"
  },

  "bins": ["gemini"],

  "detect": {
    "command": "gemini --version",
    "expectExitCode": 0
  },

  "installHints": {
    "manual": "Install or update Gemini CLI using Google's supported installation instructions at https://geminicli.com/docs/"
  },

  "auth": {
    "required": true,
    "command": "gemini",
    "instructions": "For headless Gemini CLI use a Gemini API key, Vertex AI, or eligible enterprise Code Assist credentials. For a personal Google AI Pro/Ultra subscription, use Antigravity CLI instead."
  },

  "meta": {
    "description": "Google Gemini CLI - AI coding assistant",
    "category": "ai-assistant",
    "homepage": "https://geminicli.com/docs/",
    "executionOwner": "google",
    "credentialModes": ["api-key", "vertex-ai", "enterprise-code-assist"],
    "headlessCommand": "gemini --prompt <prompt> --output-format stream-json"
  }
}
