{
  "id": "binary:jq",
  "kind": "binary",
  "name": "jq",
  "version": "1.7.1",
  "delivery": "remote",
  "install": {
    "source": "download",
    "platforms": {
      "darwin-arm64": {
        "url": "https://github.com/jqlang/jq/releases/download/jq-1.7.1/jq-macos-arm64",
        "checksum": {
          "algo": "sha256",
          "value": "0bbe619e663e0de2c550be2fe0d240d076799d6f8a652b70fa04aea8a8362e8a"
        },
        "extract": {
          "type": "raw"
        }
      },
      "darwin-x64": {
        "url": "https://github.com/jqlang/jq/releases/download/jq-1.7.1/jq-macos-amd64",
        "checksum": {
          "algo": "sha256",
          "value": "4155822bbf5ea90f5c79cf254665975eb4274d426d0709770c21774de5407443"
        },
        "extract": {
          "type": "raw"
        }
      },
      "linux-x64": {
        "url": "https://github.com/jqlang/jq/releases/download/jq-1.7.1/jq-linux-amd64",
        "checksum": {
          "algo": "sha256",
          "value": "5942c9b0934e510ee61eb3e30273f1b3fe2590df93933a93d7c58b81d19c8ff5"
        },
        "extract": {
          "type": "raw"
        }
      }
    }
  },
  "bins": [
    "jq"
  ],
  "detect": {
    "command": "jq --version",
    "expectExitCode": 0
  },
  "meta": {
    "description": "Command-line JSON processor",
    "category": "data"
  }
}
