{
  "id": "binary:sqlite",
  "kind": "binary",
  "name": "SQLite",
  "version": "system",
  "delivery": "system",
  "install": {
    "source": "system",
    "platforms": {
      "darwin": {
        "preinstalled": true
      },
      "linux": {
        "preinstalled": false
      },
      "win32-x64": {
        "source": "download",
        "delivery": "remote",
        "url": "https://sqlite.org/2024/sqlite-tools-win-x64-3450000.zip",
        "checksum": {
          "algo": "sha256",
          "value": "771d3442164bc3b38c88365f5305b8e2efd9eddd10d59aeab114ac2ef99e2784"
        },
        "extract": {
          "type": "zip"
        }
      }
    }
  },
  "bins": [
    "sqlite3"
  ],
  "detect": {
    "command": "sqlite3 --version",
    "expectExitCode": 0
  },
  "installHints": {
    "brew": "brew install sqlite",
    "apt": "sudo apt install sqlite3",
    "manual": "Pre-installed on macOS"
  },
  "meta": {
    "description": "Embedded SQL database engine",
    "category": "database"
  }
}
