{
  "id": "runtime:node-22-23-2",
  "kind": "runtime",
  "name": "Node.js 22.23.2",
  "version": "22.23.2",
  "delivery": "remote",
  "install": {
    "source": "download",
    "platforms": {
      "darwin-arm64": {
        "url": "https://nodejs.org/dist/v22.23.2/node-v22.23.2-darwin-arm64.tar.gz",
        "checksum": {
          "algo": "sha256",
          "value": "61130f394c1630d211dd50aecc4353d379480f36d3ac913cd85dbba1aed585c6"
        },
        "extract": {
          "type": "tar.gz",
          "strip": 1
        }
      },
      "darwin-x64": {
        "url": "https://nodejs.org/dist/v22.23.2/node-v22.23.2-darwin-x64.tar.gz",
        "checksum": {
          "algo": "sha256",
          "value": "58e99022c2ff89395576cc7fd4d98cea24bb68081475d5f88b801ee8729fb026"
        },
        "extract": {
          "type": "tar.gz",
          "strip": 1
        }
      },
      "linux-x64": {
        "url": "https://nodejs.org/dist/v22.23.2/node-v22.23.2-linux-x64.tar.gz",
        "checksum": {
          "algo": "sha256",
          "value": "b294a556e639d64338823920e5866c21c02741742d2e1529ee1a225c1ec9252a"
        },
        "extract": {
          "type": "tar.gz",
          "strip": 1
        }
      },
      "linux-arm64": {
        "url": "https://nodejs.org/dist/v22.23.2/node-v22.23.2-linux-arm64.tar.gz",
        "checksum": {
          "algo": "sha256",
          "value": "013b59cfd2819703a6f4a14ab891fc46fc2a4e3f5bcd92de3fb4929b43e35b30"
        },
        "extract": {
          "type": "tar.gz",
          "strip": 1
        }
      }
    }
  },
  "bins": {
    "node": {
      "path": "bin/node"
    },
    "npm": {
      "path": "bin/npm"
    },
    "npx": {
      "path": "bin/npx"
    }
  },
  "detect": {
    "command": "node --version",
    "expectExitCode": 0
  },
  "meta": {
    "description": "Versioned Node.js 22.23.2 runtime for npm tools with explicit runtime bindings",
    "category": "runtime"
  }
}
